{
  "contract_version": "pack-declaration/1",
  "pack": "fixture-minimal",
  "version": "0.1.0",
  "framework_contracts": ["generation-plan/1", "generation-scope/1", "knowledge-object/1"],
  "produces": [
    { "class": "type",             "track": "deterministic", "from": ["definition"] },
    { "class": "state-machine",    "track": "deterministic", "from": ["lifecycle"] },
    { "class": "conformance-test", "track": "deterministic", "from": ["rule", "lifecycle"] },
    { "class": "validator",        "track": "judged",        "from": ["rule"] }
  ]
}
